[
  {
    "id": "rotator_cuff_tendon_complex_r",
    "name_ta": "Tendines musculorum rotatorum",
    "name_common": "Rotator cuff tendon complex",
    "side": "right",
    "region": "shoulder",
    "tendon_type": "flat_aponeurotic",
    "parent_muscles": [
      "supraspinatus_r",
      "infraspinatus_r",
      "teres_minor_r",
      "subscapularis_r"
    ],
    "attachments": {
      "proximal_attachment": {
        "type": "muscle",
        "ref": "supraspinatus_r",
        "landmark": "supraspinatus muscle belly (representative)"
      },
      "distal_attachment": {
        "type": "bone",
        "ref": "humerus_r",
        "landmark": "greater tubercle (supraspinatus/infraspinatus/teres minor) and lesser tubercle (subscapularis)"
      }
    },
    "parts": [
      {
        "id": "rotator_cuff_r_supraspinatus",
        "name": "Supraspinatus tendon",
        "function_note": "Contains the hypovascular 'critical zone' -- a watershed region between the tendon's osseous and muscular blood supply, implicated in degenerative rotator cuff tearing (the ~1cm-proximal-to-insertion distance and 'single most common tear site' framing are widely repeated but trace to older/separate sources, not to the cited paper itself -- narrowed after adversarial fact-check, see docs/VERIFICATION.md).",
        "source": "Lohr JF, Uhthoff HK (1990) 'The microvascular pattern of the supraspinatus tendon.' Clin Orthop Relat Res 254:35-38 -- documents the hypovascular 'critical zone' near the supraspinatus tendon's insertion, a watershed region between osseous and tendinous blood supply implicated in degenerative rotator cuff tearing.",
        "parent_muscle": "supraspinatus_r",
        "attachment_or_location": "greater tubercle, superior facet"
      },
      {
        "id": "rotator_cuff_r_infraspinatus",
        "name": "Infraspinatus tendon",
        "function_note": "Blends with the supraspinatus tendon anteriorly and the teres minor tendon posteriorly, forming a continuous cuff rather than three fully separate insertions.",
        "source": "Gray's Anatomy for Students, 4th ed. (Drake, Vogl, Mitchell)",
        "parent_muscle": "infraspinatus_r",
        "attachment_or_location": "greater tubercle, middle facet"
      },
      {
        "id": "rotator_cuff_r_teres_minor",
        "name": "Teres minor tendon",
        "function_note": "The most posterior and, functionally, the least injured of the four rotator cuff tendons.",
        "source": "Gray's Anatomy for Students, 4th ed. (Drake, Vogl, Mitchell)",
        "parent_muscle": "teres_minor_r",
        "attachment_or_location": "greater tubercle, inferior facet"
      },
      {
        "id": "rotator_cuff_r_subscapularis",
        "name": "Subscapularis tendon",
        "function_note": "The only rotator cuff tendon inserting on the lesser tubercle (anterior); its upper fibers form the floor of the bicipital (intertubercular) groove alongside the transverse humeral ligament.",
        "source": "Gray's Anatomy for Students, 4th ed. (Drake, Vogl, Mitchell)",
        "parent_muscle": "subscapularis_r",
        "attachment_or_location": "lesser tubercle"
      }
    ],
    "function": "The confluent tendinous insertion of the four rotator cuff muscles onto the humeral tubercles, functioning as a dynamic stabilizing 'cuff' around the glenohumeral joint that centers the humeral head against the much larger deltoid's compressive/shear forces during arm elevation.",
    "prp_injection_approach": {
      "transducer_placement": "Arm placed in modified Crass position (hand on ipsilateral posterior hip pocket) to bring the supraspinatus tendon anterior to the acromion; probe placed longitudinally along the tendon's long axis from the greater tubercle footprint back toward the myotendinous junction, then rotated 90 degrees for a short-axis pass; posterior probe placement over the infraspinatus/teres minor footprint and anterior placement over the subscapularis/bicipital groove for those tendons.",
      "target_zone": "The critical zone of the supraspinatus tendon -- the hypovascular watershed roughly 1 cm proximal to its greater-tubercle insertion -- and, for the other three cuff tendons, the region of documented tendinosis or partial-thickness (bursal- or articular-sided) tearing on preprocedure imaging; injection is peppered through this zone rather than delivered as a single bolus.",
      "depth_layer": "Superficial to the tendon lies the subacromial-subdeltoid bursa and deltoid muscle; deep to the tendon is the humeral head articular cartilage and, at the critical zone, the joint capsule -- the needle should stay within tendon substance and not penetrate into the glenohumeral joint.",
      "identification_cues": "Focal hypoechoic or heterogeneous thickening of the tendon at the critical zone, loss of the normal fibrillar echotexture, cortical irregularity of the greater tubercle, and increased Doppler flow (neovascularity) correlating with the symptomatic side; dynamic abduction/adduction can reveal subacromial impingement of the thickened tendon.",
      "structures_at_risk": ["axillary nerve (quadrangular space, inferior to the teres minor)", "suprascapular nerve and vessels (spinoglenoid notch, posterior approach)", "long head of biceps tendon (anterior approach to subscapularis)"],
      "notes": "Evidence is genuinely mixed and heterogeneous: a 2021 systematic review/meta-analysis of 8 RCTs found PRP injection safe and effective for pain and function in nonoperative rotator cuff tendinopathy, while other systematic reviews (e.g. Feltri et al. 2022) found PRP augmentation reduces retear rate after surgical repair but does not clearly improve nonoperative clinical outcomes over exercise/saline -- report this as real but unsettled evidence, not a slam-dunk indication.",
      "source": "A Hamid MS, Sazlina SG (2021) 'Platelet-rich plasma for rotator cuff tendinopathy: A systematic review and meta-analysis.' PLoS One 16(5):e0251111, doi:10.1371/journal.pone.0251111 (https://doi.org/10.1371/journal.pone.0251111) -- retrieved via PubMed."
    },
    "source": "Gray's Anatomy for Students, 4th ed. (Drake, Vogl, Mitchell); Terminologia Anatomica (FICAT 1998); Lohr JF, Uhthoff HK (1990) 'The microvascular pattern of the supraspinatus tendon.' Clin Orthop Relat Res 254:35-38 -- documents the hypovascular 'critical zone' near the supraspinatus tendon's insertion, a watershed region between osseous and tendinous blood supply implicated in degenerative rotator cuff tearing."
  },
  {
    "id": "biceps_brachii_tendon_complex_r",
    "name_ta": "Tendines musculi bicipitis brachii",
    "name_common": "Biceps brachii tendon complex",
    "side": "right",
    "region": "shoulder_elbow",
    "tendon_type": "intra_articular",
    "parent_muscles": [
      "biceps_brachii_r"
    ],
    "attachments": {
      "proximal_attachment": {
        "type": "muscle",
        "ref": "biceps_brachii_r",
        "landmark": "biceps brachii muscle belly (representative)"
      },
      "distal_attachment": {
        "type": "bone",
        "ref": "radius_r",
        "landmark": "radial tuberosity"
      }
    },
    "parts": [
      {
        "id": "biceps_tendon_r_lh",
        "name": "Long head tendon",
        "function_note": "Originates from the supraglenoid tubercle and glenoid labrum (with documented variability in exactly how much of each contributes) and runs intra-articularly across the humeral head before exiting the joint capsule to descend in the intertubercular (bicipital) groove -- an unusual intra-articular-then-extra-articular course among tendons, and a common site of tendinopathy/instability.",
        "source": "Vangsness CT Jr, Jorgenson SS, Watson T, Johnson DL (1994) 'The origin of the long head of the biceps from the scapula and glenoid labrum.' J Bone Joint Surg Br 76(6):951-954 -- cadaveric study of the long head tendon's variable supraglenoid tubercle/labral origin. This paper's own scope is specifically the tendon's proximal origin (the roughly 50/50 labrum-vs-tubercle split it documents, with 4 distinct origin patterns); the tendon's subsequent intra-articular course across the humeral head and exit into the bicipital groove is separately well-established general anatomy (Gray's/Kenhub level), not a claim made by this specific citation (attribution narrowed after adversarial fact-check, see docs/VERIFICATION.md).",
        "parent_muscle": "biceps_brachii_r",
        "attachment_or_location": "supraglenoid tubercle / glenoid labrum"
      },
      {
        "id": "biceps_tendon_r_sh",
        "name": "Short head tendon",
        "function_note": "Originates from the coracoid process (conjoint tendon with coracobrachialis) and, unlike the long head, has an entirely extra-articular course.",
        "source": "Gray's Anatomy for Students, 4th ed. (Drake, Vogl, Mitchell)",
        "parent_muscle": "biceps_brachii_r",
        "attachment_or_location": "coracoid process"
      },
      {
        "id": "biceps_tendon_r_distal",
        "name": "Distal (bicipital) tendon + bicipital aponeurosis (lacertus fibrosus)",
        "function_note": "The distal tendon inserts on the radial tuberosity; a fibrous expansion (the bicipital aponeurosis/lacertus fibrosus) fans off it medially to blend with the deep antebrachial fascia over the forearm flexor mass -- clinically relevant as a landmark protecting the underlying brachial artery and median nerve during venipuncture at the cubital fossa.",
        "source": "Gray's Anatomy for Students, 4th ed. (Drake, Vogl, Mitchell)",
        "parent_muscle": "biceps_brachii_r",
        "attachment_or_location": "radial tuberosity"
      }
    ],